{
  "$schema": "../case.schema.json",
  "suite": "protocol",
  "area": "legacy",
  "title": "Legacy MCP versions",
  "sources": [
    "plan.md §10.2",
    "ADR 018 (amended in M1)"
  ],
  "cases": [
    {
      "id": "legacy/2025-11-25-flow",
      "title": "The 2025-11-25 flow works in a standalone SDK runtime",
      "requirements": [
        "plan.md §10.2"
      ],
      "level": "component",
      "targets": [
        "java",
        "python",
        "typescript",
        "dotnet"
      ],
      "perTarget": true,
      "when": "A 2025-11-25 client talks to a standalone SDK runtime and runs initialize, notifications/initialized, ping, tools/list, tools/call, the GET SSE stream and receives list_changed",
      "then": [
        "Each works through the official SDK; the Gateway is not involved"
      ],
      "status": "authored"
    },
    {
      "id": "legacy/2025-06-18-flow",
      "title": "The 2025-06-18 flow works in a standalone SDK runtime",
      "requirements": [
        "plan.md §10.2"
      ],
      "level": "component",
      "targets": [
        "java",
        "python",
        "typescript",
        "dotnet"
      ],
      "perTarget": true,
      "when": "A 2025-06-18 client talks to a standalone SDK runtime and runs initialize, notifications/initialized, ping, tools/list, tools/call, the GET SSE stream and receives list_changed",
      "then": [
        "Each works through the official SDK; the Gateway is not involved"
      ],
      "status": "authored"
    },
    {
      "id": "legacy/other-versions",
      "title": "The Gateway refuses every session-era version",
      "requirements": [
        "ADR 018 amendment"
      ],
      "level": "component",
      "targets": [
        "gateway"
      ],
      "when": "initialize with 2025-11-25, 2025-06-18 or 2025-03-26, or tools/list with an older MCP-Protocol-Version and no _meta version, or GET /mcp",
      "then": [
        "UnsupportedProtocolVersion -32022 listing only 2026-07-28",
        "GET returns 405"
      ],
      "status": "passing",
      "evidence": "apps/gateway/tests/core.rs session_era_clients_are_refused_with_the_supported_version"
    },
    {
      "id": "legacy/version-header",
      "title": "MCP-Protocol-Version is honoured only on the legacy path",
      "requirements": [
        "gateway-v1.proposed.yaml"
      ],
      "level": "component",
      "targets": [
        "gateway"
      ],
      "when": "A 2026-07-28 request carries MCP-Protocol-Version 2025-06-18",
      "then": [
        "The _meta version decides"
      ],
      "status": "passing",
      "evidence": "apps/gateway/tests/core.rs modern_core_drops_ping_and_discovers_every_supported_version"
    },
    {
      "id": "legacy/stdio-era-lock",
      "title": "A stdio connection locks to the first version",
      "requirements": [
        "plan.md §5.10",
        "tool-sdk/spec/sdk-compat/2026-10-10/results.md gap 8"
      ],
      "level": "component",
      "targets": [
        "java",
        "python",
        "typescript",
        "dotnet"
      ],
      "perTarget": true,
      "when": "A 2026-07-28 message is followed by initialize on the same stdio connection, and the reverse",
      "then": [
        "The second era is refused (-32022, the TS and Python behaviour, applied everywhere)"
      ],
      "status": "authored"
    }
  ]
}
